{
  "$schema": "http://json-schema.org/draft-07/schema#",
  "title": "Order",
  "type": "object",
  "required": ["order_uid", "track_number", "entry", "delivery", "payment", "items", "locale", "customer_id", "delivery_service", "shardkey", "sm_id", "date_created", "oof_shard"],
  "properties": {
    "order_uid": {
      "type": "string"
    },
    "track_number": {
      "type": "string"
    },
    "entry": {
      "type": "string"
    },
    "delivery": {
      "$ref": "#/definitions/delivery"
    },
    "payment": {
      "$ref": "#/definitions/payment"
    },
    "items": {
      "type": "array",
      "items": {
        "$ref": "#/definitions/item"
      }
    },
    "locale": {
      "type": "string"
    },
    "internal_signature": {
      "type": ["string", "null"]
    },
    "customer_id": {
      "type": "string"
    },
    "delivery_service": {
      "type": "string"
    },
    "shardkey": {
      "type": "string"
    },
    "sm_id": {
      "type": "integer"
    },
    "date_created": {
      "type": "string",
      "format": "date-time"
    },
    "oof_shard": {
      "type": "string"
    }
  },
  "definitions": {
    "delivery": {
      "type": "object",
      "required": ["name", "phone", "zip", "city", "address", "region", "email"],
        "properties": {
          "name": { "type": "string"},
          "phone": { "type": "string"},
          "zip": { "type": "string"},
          "city": { "type": "string"},
          "address": { "type": "string"},
          "region": { "type": "string"},
          "email": { "type": "string", "format": "email" }
        }
    },
    "payment": {
      "type": "object",
      "required": ["transaction", "currency", "provider", "amount", "payment_dt", "bank", "delivery_cost", "goods_total", "custom_fee"],
      "properties": {
        "transaction": { "type": "string" },
        "request_id": { "type": ["string", "null"] },
        "currency": { "type": "string" },
        "provider": { "type": "string" },
        "amount": { "type": "integer", "minimum": 0 },
        "payment_dt": { "type": "integer" },
        "bank": { "type": "string" },
        "delivery_cost": { "type": "integer", "minimum": 0 },
        "goods_total": { "type": "integer", "minimum": 0 },
        "custom_fee": { "type": "integer", "minimum": 0 }
      }
    },
    "item": {
      "type": "object",
      "required": ["chrt_id", "track_number", "price", "rid", "name", "sale", "size", "total_price", "nm_id", "brand", "status"],
      "properties": {
        "chrt_id": { "type": "integer" },
        "track_number": { "type": "string" },
        "price": { "type": "integer", "minimum": 0 },
        "rid": { "type": "string" },
        "name": { "type": "string" },
        "sale": { "type": "integer", "minimum": 0, "maximum": 99},
        "size": { "type": "string" },
        "total_price": { "type": "integer", "minimum": 0 },
        "nm_id": { "type": "integer" },
        "brand": { "type": "string" },
        "status": { "type": "integer" }
      }
    }
  }
}