{
  "order_uid": "l0k9j8h7g6f5d4s3a2p1",
  "track_number": "TRACKNUM564738291",
  "entry": "WBIL",
  "delivery": {
    "name": "Alex Johnson",
    "phone": "+19876543210",
    "zip": "345678",
    "city": "Los Angeles",
    "address": "Sunset Boulevard, 202",
    "region": "CA",
    "email": "alexj@example.com"
  },
  "payment": {
    "transaction": "l0k9j8h7g6f5d4s3a2p1",
    "request_id": "",
    "currency": "USD",
    "provider": "stripe",
    "amount": 500,
    "payment_dt": 1638300000,
    "bank": "Chase",
    "delivery_cost": 50,
    "goods_total": 450,
    "custom_fee": 0
  },
  "items": [
    {
      "chrt_id": 9999999,
      "track_number": "TRACKNUM564738291",
      "price": 300,
      "rid": "itemrid345",
      "name": "Smartwatch",
      "sale": 0,
      "size": "One Size",
      "total_price": 300,
      "nm_id": 1010101,
      "brand": "BrandE",
      "status": 201
    },
    {
      "chrt_id": 1212121,
      "track_number": "TRACKNUM564738291",
      "price": 150,
      "rid": "itemrid678",
      "name": "Wireless Charger",
      "sale": 0,
      "size": "Standard",
      "total_price": 150,
      "nm_id": 1313131,
      "brand": "BrandF",
      "status": 201
    }
  ],
  "locale": "en",
  "internal_signature": "",
  "customer_id": "customer012",
  "delivery_service": "express",
  "shardkey": "13",
  "sm_id": 4,
  "date_created": "2021-12-01T18:00:00Z",
  "oof_shard": "5"
}