{
  "order_uid": "q1w2e3r4t5y6u7i8o9p0",
  "track_number": "TRACKNUM192837465",
  "entry": "WBIL",
  "delivery": {
    "name": "John Smith",
    "phone": "+11234567890",
    "zip": "789012",
    "city": "New York",
    "address": "5th Avenue, 101",
    "region": "NY",
    "email": "johnsmith@example.com"
  },
  "payment": {
    "transaction": "q1w2e3r4t5y6u7i8o9p0",
    "request_id": "",
    "currency": "USD",
    "provider": "paypal",
    "amount": 200,
    "payment_dt": 1638200000,
    "bank": "Bank of America",
    "delivery_cost": 20,
    "goods_total": 180,
    "custom_fee": 0
  },
  "items": [
    {
      "chrt_id": 7777777,
      "track_number": "TRACKNUM192837465",
      "price": 180,
      "rid": "itemrid012",
      "name": "Headphones",
      "sale": 0,
      "size": "Standard",
      "total_price": 180,
      "nm_id": 8888888,
      "brand": "BrandD",
      "status": 201
    }
  ],
  "locale": "en",
  "internal_signature": "",
  "customer_id": "customer789",
  "delivery_service": "postal",
  "shardkey": "12",
  "sm_id": 3,
  "date_created": "2021-11-30T15:45:00Z",
  "oof_shard": "4"
}