{
  "order_uid": "z9y8x7w6v5u4t3s2r1q0",
  "track_number": "TRACKNUM987654321",
  "entry": "WBIL",
  "delivery": {
    "name": "Мария Петрова",
    "phone": "+79997654321",
    "zip": "654321",
    "city": "Санкт-Петербург",
    "address": "Невский проспект, дом 1",
    "region": "Ленинградская область",
    "email": "petrova@example.com"
  },
  "payment": {
    "transaction": "z9y8x7w6v5u4t3s2r1q0",
    "request_id": "",
    "currency": "RUB",
    "provider": "tinkoff",
    "amount": 8000,
    "payment_dt": 1638100000,
    "bank": "Тинькофф",
    "delivery_cost": 300,
    "goods_total": 7700,
    "custom_fee": 0
  },
  "items": [
    {
      "chrt_id": 5555555,
      "track_number": "TRACKNUM987654321",
      "price": 7700,
      "rid": "itemrid789",
      "name": "Планшет",
      "sale": 0,
      "size": "10 дюймов",
      "total_price": 7700,
      "nm_id": 6666666,
      "brand": "BrandC",
      "status": 201
    }
  ],
  "locale": "ru",
  "internal_signature": "",
  "customer_id": "customer456",
  "delivery_service": "pickup",
  "shardkey": "11",
  "sm_id": 2,
  "date_created": "2021-11-29T12:30:00Z",
  "oof_shard": "3"
}